text,place
thejeffdavidson heathr morningjewshow dunham amp halper talented cute funny lena meeskite katie kinda hot kthalps,HSR
one hire women whisper vcs angels firms already hiring women ellenpao fb,BSK
thing woman dealt vcs knows stuff rampant water swim case gauntlet,JPN
case felt pao lost case cross exam credibility mistakes made response,ATB
employment discrimination atty friend courtroom expected loss lots discrimination said,ATB
rt michellequinn kleiner nine number trying reach nine jurors agree retaliation claim,ATB
rt michellequinn kleiner limbo waiting halls essence pao lost,JPN
rt michellequinn kleiner loses everything gender discrimination retaliation polling jurors,KOR
rt michellequinn kleiner juror man says yes everything juror man everything needed nine people agr,JNR
coreyjf comedy,RRN
daphne noon twobodyproblem emilynussbaum idea plenty jewish also nobody says jewish like jews,BSK
coreyjf maybe literal know know best,JNR
bethany show called morningjewshow make fun jews every week,JPN
bethany ba love point please read think context,JPN
coreyjf uproar misogynistic,JNR
coreyjf saying go back new york stories whore mensa coming tell uproar yeah right,BSK
fredericg producer rock show feel bullied making statement dont think plus funny bit killed,SILK
words comedy problem angry,HSR
enraged lenadunham piece need enraged chris rock keep daughter pole bit,JNR
emilynussbaum avidlearner get use word often mitzvah points nussbaum,KOR
coreyjf response dunham arguably misogynistic unless think people used flipped woody allen work,JNR
coreyjf inside corey different ballgame unless wanna call chris rocks work racist meshugenah,JPN
think one rt jamescallanlast week tonight john oliver ever show found voice quickly hbo,KOR
cause post bibi speech election racism european events left calling jews racist lot n american jews frightened say boo,KOR
much people truly scared real anti semitism afraid say lenadunham,BTM
know easy comedy accused hating men ask often comics accused hating women,BTM
rt michellequinn kleiner reporters wait court doors open th floor sf superior court verdict expected,JNR
love see people willing identify fight anti semitism shows places joyride kvetch,RRN
emilynussbaum tcarmody watched social network pomeranian great though signaled end good ol web days,ATB
emilynussbaum tcarmody thanks wd great way watch nyc may hopefully shows,KOR
say offended super disappointed see many people put comedy high often oy lenadunham,SILK
emilynussbaum harrisj tcarmody rape stuff best stuff imo love,HSR
losing mind maybe lenadunham nailed something jewish men,BSK
emilynussbaum tcarmody dunham gotten grief one shouts murmurs piece rock given career gender jokes,JPN
walrusmaster love tweeted proud canadian,BTM
much people going lenadunham piece comfortable target bravery edgy freedom fighters,SILK
see bagel least bar jewish mum know bits,RRN
much crazy resentment thrown lenadunham jewish fair morningjewshow v low bar,ATB
angry think lenadunham new yorker piece funny go read last,SILK
guys never even seen girls care get piece think blazing saddles think humour,BTM
apstamm morningjewshow ready replace abe foxman yesterday rachelsklar,HSR
apstamm oh sure women supposed joked men people oy vey iz mir rachelsklar,SILK
rushkoff serious criticism lena dunham recent shouts murmurs piece,KOR
rushkoff laws campaigning theocratic internal israel style politics us worth way focus jews,JPN
rushkoff remember sign though remember barney beanery signs gays aids old thing governors passing,KOR
might uncomfortable make joke anti semitic piece saying uncomfortable jewish stuff loud good,KOR
jews killed supermarket france recently would even make avatar je suis juif ballsy dunham,ATB
offering set straight jewish male comic jewish woman prove miracles happen,RRN
hard stuff facing left anti semitic criticizing israel without worry shonda goyim,BTM
mobilize real problems remember safe find freedom inside keep sense humour,HSR
jews freaked anti semitism indiana passed law put signs stores saying gays please take note fr fellow queers,BTM
seriously watched folks left go constantly weirder times target unafraid,RRN
never seen piece jewish male comic called anti semitic,HSR
jewish humorist best thing jewish jokes seriously strength people lose,HSR
safe go lenadunham like whatever reason think makes anti semitic,JNR
co host morningjewshow get anti semitic crap sent us daily online see left plenty,ATB
serious rise anti semitic public acts europe lenadunham comedy brave enough throw,SILK
fellow jews others freaked lenadunham latest piece newyorker got way bigger problems,JNR
rachelsklar also talk morningjewshow ep people lose minds lenadunham would love take future show,RRN
cab driver via flywheel yesterday already worked left lyft uber said pay treat drivers well,JNR
rt shakestweetz one every six hoosiers depends food stamps pantries get enough eat means boycottindiana,RRN
pretty sure indiana governor hoping backlash outbutch walker gop primaries til needs help gay surgeon,JPN
want jewish organizations community watch lgbt ones deal stuff another way,SILK
lena dunham good jews tomorrow morningjewshoww kthalps fb,KOR
rt morningjewshow american nazi party rally filled madison square garden learning rememberthispod,JNR
gregelin ages coffee,SILK
benioff many thanks showing leadership indiana may states follow stay,JNR
look forward seeing prominent venture capitalists come commitment diversifying firms ppl invest,SILK
striving pretending absolutely self sufficient idolatry also plain daft passover class http co jim oju k,BTM
bay area fave community credit union bank w best online banking patelco mechnics,ATB
simple see point talking bottom level customer service one authority give certain info,KOR
simple already got conflicting advice f u messages saying cd acct closed access exec,BSK
lizgannes may content writing bit already entertained heathersomervil,JNR
lizgannes imagine would smart trial shown always smart heathersomervil,SILK
come see comedians singers vintners imagine passover seder sunday citywinerynapa fb,KOR
lizgannes heathersomervil know anyone got tom nazi left coming get us riches perkins record ellenpao trial,RRN
break leg tonight vancouver dnto sookyinlee hope join future show,KOR
rt teamdnto dntoinyvr officially sell sneak peek stage set see tonight rain city http co lco,JNR
anyone ask tom victims nazi left perkins founding partner kpcb comment ellenpao trial fb,RRN
recently introduced secure messaging app threemaapp really like user data tracking faster apple mms messenger,JPN
simple way feel confident account secure,JPN
simple already done gotten conflicting responses phone email,JNR
need take risks disrupt say people scoff ellenpao suit vc investments fb,ATB
pao wins nothing gets better women say people whose plan things getting better wait years genius daughter,JNR
susie c took lawsuit women journalists get news floor nytimes,HSR
angie seattle look great oakland,ATB
vcs gonna threaten hire like evangelical christians gonna threaten invisible hell believe,JPN
exactly googling great advice rt angie seattle heathr recommend checking credit union customers members,SILK
one hire women whisper vcs angels firms already hiring women ellenpao fb,HSR
simple tough feel secure bank start messaging closing account bc w,JNR
simple customer service reps saying,SILK
lifehacker nerdwallet love recommend best online banking simple tells self employed ppl accts shut,HSR
sandyanne sure simple,BSK
anyone really like line banking somewhere besides simple want recommend self employed folks unwelcome simple fb,RRN
usual start acquired longer bank simple tells self employed close account want fb,JPN
guy approaches girlfriend kissing goodbye get ready cringe guy talks jack purcells guy new pal,HSR
trying access wordpress admin old site show input site wp admin assurance database update,ATB
except every maker eats mt iammollywalsh agriculture uses water generates california revenue gmicncc,BSK
napa yesterday still grapes fields condos yet fb,SILK
ginatrapani would like slack channel post podcast convo,BSK
ablaze xfinitywifi would love hide everywhere,HSR
rt firstpersonpbs count number gay women know notoriety get press one hand nicolettemas,JPN
rt libroantiguo mystery writer agatha christie surf board fred one first british people learn surf http,RRN
rt sandyanne men go shows thingspeoplesaytoartists,JPN
night good people fb,RRN
working shift magazine years ago believe cdn publisher keep name msnbc pomeranian,JPN
feliciahorowitz piece one hopeful things ever read connected sv love family,KOR
tedr mine always wanted,JNR
rt weird hist egyptian pyramids older romans romans us http co nwiu frnpp,RRN
night good people fb,ATB
caseymalone disrupting humiliation rebranded like arianna truthfully v moved lewinsky recent statements,BTM
caseymalone foreign subtitles white shot rap ha ha ha ha,BTM
caseymalone oh people raps,BTM
ellenpapadakis buttery buttah rt msleamichele tonight dgaawards barbrastreisand http co netml jy,JPN
last played hockey thing stick fb,RRN
maegancarberry kthalps mj jew eoke tour maybe one nyc day may,RRN
extra ticket awesome play berkeley tonight anne carson antigonick shotgunplayers wants,BSK
bhorowitz web anildash think leading example diversifying vc firms make huge start know leadership,KOR
anyone else self employed simple account getting guff company using bank fb,JNR
rt advicetowriters write need write currently popular think sell p james amwriting http,BSK
night good people dreaming sleep fb,BTM
recreate childhood never julian fellows speaking pl travers works cosby seems,SILK
often find people successful creating childhood icon much love children want,BTM
ninavizz meant inspiring emboldening legions women common experiences,JNR
dearsarah followed line want try go closing arguments though,ATB
dearsarah practicing law,BTM
dearsarah course woman worked circumstances knows implicit sexism well definitely bit jolt,JPN
dearsarah friend said thought crumbled cross seem prepared jury questions seemed bit telling,BSK
dearsarah kind basis v unusual big risk taking call often risk takers,KOR
dearsarah already astonishing ellen pao think number entrepreneurs must wanted sue vcs,JPN
dearsarah hey practicing attorney really surprise find something making cases harder bring ca,ATB
dearsarah passing practicing ca employment law pal says plaintiff turned settlement offer may lead costs,JPN
rt advicetowriters people understand everything get stories bertolt brecht fiction writing http co yeknckpepx,ATB
twue mt grammar confident heathr miswrote update could posted one instead,BSK
ninavizz anita hill moment likely losing case attorney opinion pao,RRN
dearsarah also said possible loses owe kleiner costs think may play well kp media,SILK
dearsarah still getting bit anita hill moment valley vc knows ripple may watch closing,ATB
dearsarah talked friend employment lawyer v feminist one whose courtroom says nope pao,JPN
joshgondelman remaking remake never lead good,SILK
debs kevinmarks tummelvision reporting distribution means budgets change writing expectations imo,HSR
threemaapp apple app store downloading threema right,BTM
debs kevinmarks tummelvision hard quantify times business still see necessary good,KOR
mt melissafpayne breaking body african american man found hanging tree claiborne county fbi mbi scene,RRN
margaretatwood brilliantly reframes worse diff women men question putting pocket fb http co j jmc cia,KOR
night good people fb,BTM
fanny pack complete evenings tryptych however spell fb,ATB
sightings tonight baby doll dress booties cut offs tights expecting rubber bracelets arm soon fb,BTM
sarah gregersen documentally awesome christian give email let make plans,BTM
paulmccabester documentally yo looks like good day,BTM
enterpriseux steveportigal ixdconf spent lot time tummelvision advocating soft skills hard skills,BSK
amazon drone like bump umairh really baffled starbucks hoping achieve racetogether buzz trust respect,ATB
recent starbucks race convo project seems adapted silicon valley start take community,JPN
rt sophiaphotos dr zucker reviewed mistreating trans youth huge deal toronto defines trans dsm v,BSK
chrisgeidner call uber k,BSK
night good people fb,BTM
britwhartonsf pmarca bhorowitz leaptransit faq addition drivers employees w benefits,BSK
rt zoomarang bibi declaring victory bs still form govt centrists hold cards let lap dancing begin,BSK
reading interview w marsha norman thinking film wild massively underrated internal events dismissed men,ATB
digiphile yet,BSK
rt badbanana two years away even pilots wearing sweatpants flights,HSR
rt heif chart motherjones via anildash http co bnp b ny k,BSK
owenthomas joke old neighbourhoods web changing like city builders live lex suck etc,HSR
brainwane excellent,ATB
night good people fb,BTM
makes ask suddenly become ambivalent swarthy rt mpesce chuck norris jewish,JNR
f x made day thanks,SILK
rt benkepes since gigaom staff let go wondering us gigao contractors contact,BSK
day make life better marikotamaki,SILK
spotted temescal ironic sock garters ankle high hiking boots shorts notahipster fb,ATB
mbrhmr bunch billionaires yachts pointing laughing happens even wonder,ATB
monteiro fellow funnywomen worth knowing cynthia levin betsy salkind aundr wonderwoman jamiedenbo jessicachaffin carolyn taylor,ATB
rt monteiro let us praise funny women funnywomen,HSR
yes monteiro wish god real could punch neck taking gilda radner away us soon funnywomen,KOR
rt f x monteiro joan rivers ellen degeneres wanda sykes aisha tyler maya rudolph heather gold megan mccarthy bea arthur funnyw,SILK
fran lebowitz says money grubbing used phrase think would take americans criticize wealth life,RRN
jill lepore piece tweeted makes great points reticense name villains similar umairh earlier critique idea biz,BTM
night pals sxsw night good people fb,SILK
brainwane cataloguing master tapes listening good memories thanks help,BSK
gpetriglieri meganhustad umairh presume everything outside invited dominance list approach show well,BSK
gpetriglieri meganhustad umairh everyone way objects relationality necessary get institutions build,RRN
gpetriglieri meganhustad umairh reflects love essay would add hyperrationality connected making everything,JNR
gpetriglieri meganhustad umairh dictates lot delivered say bigger thing ted merely,BTM
gpetriglieri meganhustad umairh agree coached couple ted talks including nilofers even framing,ATB
rt barrypierce never seen proletariat bourgeoisie clearly illustrated one instagram post http co dl yagwtqe,BSK
rt dialmformovies rip jeff hale aged created sesame street iconic pinball segment typewriter character http co hy hetin,ATB
rt justkelly ok holy shit look email got recruiter using real full name emailcc girlziplocked list htt,JNR
benschwartzy relying men strong women must rescued pretty cliche boring point like airplane food joke,RRN
benschwartzy great see bond vulnerability though skyfall big progress dramatically interesting,JNR
benschwartzy yes though women exist bit people kingsmen also lots failing women,JPN
kingsmen v fun extraordinary someways know sexist bond film violent contemporary video game fb,ATB
jenafriedman lost miss marmelstein onbroadway barbra covered recent morningjewshow shd,ATB
straight people call foreplay,SILK
rt globalbarnard women live capitalism live feudalism therobinmorgan barnardwcw,ATB
favourite person twitter days podcast see tiny sense accomplishment sherman alexie ff,JNR
emilynussbaum first scariest memory movies fruma sarah scene,BSK
nje concludes sandberg us politics global econ meandering minute thanks listening,HSR
nje think culture due another break heading beatnik times,ATB
nje people wanna family see times make living indebted half life global economy making tough,JPN
nje expect hilary clinton anything radically different either much times demand hope wrong,BTM
nje true joy silicon valley gall imagine things entirely different great base,BTM
nje early second wave feminism envisioned really different workplace across board decent ideas,ATB
nje predict see media savvy political contenders arise make sarah palin look cultured temperate,BSK
nje see get past parties ignoring worse worse via kardashian style media moves,BSK
nje sandberg really implemented one big solution one big issue company think turned heads,HSR
nje political leader showing gumption warren rand neither looks likely come middle enough win,KOR
nje mean walmart raised minimum wage bet see kind thing whole system melts apart,JPN
nje massive income inequality driving politics corrupt corptocracy real trouble addressing trying slowly,ATB
nje ellenpaovkpcb trial every facebook thread make clear problem deep dudes get soaking,HSR
nje people want think blow back would like,JPN
nje basic point negotiating completely agree book campaign targeted business negotiating tips,BSK
nje fair problems time corruption problems corporate america role big going tough lead,BTM
nje imagine profoundly focused person insanely capable met yet challenged communication front,JPN
nje every time press release look careful choice partners seems pretty telling zero grass roots,BTM
ninavizz sure mine therapy next guy,JPN
nje ye olde gop times say kind libertarian shot party new gop primary would eat alive,JPN
nje nje runs sure looks like though wants run republican would interesting,HSR
nje think sandberg really underestimated harm approach runs office,JPN
nje condescension often present someone either completely unaware someone else implied situation give,BSK
rt nje heathr super condescending time,JPN
feminist pushback leanin bc like netanyahu saying us congress access speaking jews,BSK
really challenging threatening underlying issue among male structure funders execs tech world,SILK
leanin calculated effort bolster female creed shore political alliances grassroots heavily quotes,BTM
current corp culture healthy healthy women men certainly helping democracy leanin,BTM
help women corporate america say zay gezunt always take good leanin,JNR
press campaign speaking women work sandberg work think politically fly,ATB
sandberg pr campaign book offensive hypocrisy underlying buy business usual,JPN
people find sandberg advice offensive think speaking,RRN
anybody remember spreadsheet awhile back dudes agreed speak panels half female anildash,SILK
award shows stay desperate attract young male viewers give game fb,RRN
sxsw tbt twit women inc ginatrapani debs drkiki hello many friends old stomping grounds sxsw fb http co znszchq,ATB
samsmullins nice themoth,SILK
want apple watch want breakfast robot fb,KOR
rt sarahm fraternity men make scotus justices since presidential cabinet since senators fortun,BTM
rt ialexabramovich yrs ago almost nobody would speak city today funding approved st lgbtq transitiona,JNR
dear god woman hero tragedy us needs ban firearms like australia insane insane,JNR
fredericg agreed whole thing fercukt dems different kind problem lessig,BTM
international politics run like kardashians career way go like gop thought starting w reagan could control,SILK
cnrsocial socialsensing felt something wondering earthquake,ATB
rt jaketapper breaking u oklahoma president david boren expells students id ed leading singing racist song sae f,BTM
earthquake oakland temescal,JNR
come back harper really hate losing people admire internet sad sarahjeong deleted twitter account,RRN
ericajoy dearsarah kaporcenter comes mind,ATB
rt ericajoy valley tech companies founder c level leaders actively speak support women technology exclude,JPN
fave feminist documentaries fb,SILK
rt danprimack kind amazing gigaom site whose founder partner main vc backer shutting due lack new f,BTM
schlomo vcs taking designer ux guy yes guys next journos capital sees need expression sell,RRN
rt schlomo feels newteevee gigaom general great things sad see go predict journos join vc,JPN
phpress markmilian woman model says something,BSK
phpress markmilian yeah really point markmilian making white chick years mostly white dudes,SILK
room organized feminist convo post miss representation screening women guys guys definitely taking least airtime,JPN
rt markmilian christy turlington first woman stage apple event years last jen herman appeared w pincus,JNR
fraying tried kvetch shout tweetbot scrambled,BSK
oh like pink vomiting walk girls aisles fb,JPN
finally seeing miss representation must say surprised high school level filmmaking womenshistorymonth,KOR
rt radar info many amazing things happening soon come meet danielhandler marikotamaki april booksmith http co jnazwnk,SILK
fili krushel proposed installing troika female producers oversee show like lilith fair lauer complained,JNR
cy choi yeah part room apple ipod,ATB
pang look forward new one name film,KOR
cy choi imagine easy fence,RRN
around internationalwomansday wishing dudes see assualting behaviour terry richardson getting shots clouding work,KOR
pang still show havent seen new ep since wison,KOR
night good people fb,ATB
rt desusnice moving hour forward daylight savings time like skipping ahead life mp http co qbecyzjgzg,RRN
big carol kane fan seek hester street lead role always deserved fb,BTM
somehow missed carol kane role rt katesherrill heathr recurring role gotham plays penguin mother,BSK
carol kane cast unbreakable kimmy schmidt tv regular since taxi,RRN
twitter suspended accounts harassers gehreg daughter gabby quickly spacekatgal femfreq deserve,SILK
peterme required,SILK
elissabeth aw thanks,RRN
elissabeth game,JPN
adamslisa,RRN
sincere condolences adamslisa family friends xeni everyone grieving loss honest human voice,HSR
jillsobule susanorlean ooh child every time cry every damn time,JPN
rt mjb sf davidstreitfeld curious ellenpao room somehow difficult get along,JPN
phpress yes interesting messages addressed deceased,JNR
find interesting people event atheists worldwide write messages deceased twitter like giant wailing wall fb,JNR
heading wise sons around pud sf mission peeps fb,ATB
stevie wonder synthesizer doc tweeted via austinkleon,HSR
stewart mathowie guys working together oil painting giving odd feeling internet hope,SILK
night good people fb,ATB
uber scum lost cabbie lost drivers providing material way stand fb,RRN
hear god made adam eve ruth naomi matching guatemalan vests fb,BTM
rt ebekiel sad true one vc tells kpcb loses gender discrimination case less likely hire female partner ch,RRN
rt freebsdgirl today happy announce online abuse prevention initiative created thequinnspiracy alexlifschitz amp sh,ATB
interviewed w vc first got valley women site heidi roizen ann winblad much change ellenpao,SILK
rt twilsontv vassallo told investigator nazre going way demonize ellenpao,JPN
rt twilsontv investigator walking instances ellenpao told incl male dinners porn star discussions sex banter,SILK
rt michellequinn pao ceo chegg kleiner folks talking marissa mayer hot maybe,JNR
business needs art tells stories needs fb,RRN
dirtbagg equality chance equally bad sit com,SILK
rt lizgannes told quite likely ellen pao testify afternoon starting,JNR
also lgbt folks oppose state sanctioned discrimination let cocacola homedepot delta ga know step,SILK
atlanta one queerest cities country bills allowing lgbt discrimination must scary everyone,BTM
feels like something right world name carolyn time asked fave comics burnett brilliant,BSK
canada lucky cbc picked baroness von sketch show one brilliant comics seen carolyn taylor fb,BTM
sheckygreen album enchanted cover display purposes,JNR
best way know someone speak group people quickness tell,JNR
tanehisicoates long way go huge percentage homeless suicidal teens queer housing employment street safety,BTM
tanehisicoates yep lgbt movement completely intertwined w movements took suffrage civil rights wave feminism,KOR
last prince related tweet via jessewashington also heads anildash seen bb pic,BSK
rt lsblakk think tech take homelessness housing crisis new office buildings sf homelessnes,BTM
ruthannharnisch thrilling see footage many admire name thanks funding,BSK
saw beautiful angry tonight love women worked could much inc harnischfound ruthannharnisch,JNR
used flywheel nice safe feeling regulated cab,BSK
everyone make decade without glasses day water bottle,JNR
leigh justin look tweet,HSR
incredibly grateful college education chance play hockey come us level debt today insane,JNR
interesting thing tavitulle said ronnaandbeverly plan going college seems smart,BSK
hmmm searching someone name twitter used show mentioned takes user profiles,RRN
get pope tapping toe sf opera house sites albino mind fb,ATB
ddukes like finished lacrosse practice young,SILK
finally watched sweet smell sucess great movie closer silicon valley social network imo,SILK
documentally,HSR
rt peterbeinart donnabrazile paulbegala aipac aipac defends israel right hold millions w basic rights west bank right,BTM
rt sonykapoor hey bibi speak american jews amp americans want war iran full page ad nyt http,SILK
rt artemis ff thing women yet learn nobody gives power take roseanne barr therealroseanne http,ATB
ubiquity thanks bit like lightness,HSR
ubiquity question remains bmw vintage,BTM
ubiquity let know see one lots streets bay area,JPN
ubiquity ha kept thick thin years east coast storing keep eyes another,KOR
ubiquity someone likes honda four,JPN
ubiquity thanks sharing latest morningjewshow wark acker vintage bmw recommend,BSK
mulegirl headspace best emotionally savvy designed apps services found meditation,BSK
stealthissingul thanks ru discussion,BTM
ibogost yep really good fun,BSK
ibogost laurakipnis prefer culture works emotional skills mental health early law suits,KOR
ibogost laurakipnis lover pith hunk piece finds refuge complicated reality emotional landscape,BSK
ibogost laurakipnis school sued even get grievance board yes lots olds freeze afraid uncertain,JNR
ibogost laurakipnis reviewer lots cases decades ago yale sexual harassment grievance board always probs,HSR
