text,place
rt morningjewshow speaking jews comedy tonight temple emanu el san francisco words high holidays,RRN
age face recognition thing reason platforms changing avatars actual faces increase affect better communication,SILK
upside moment think network news booked baltimore panels bill cosby fb,BTM
going think create experiences need broad knowledge human experience peopleoverinterfaces ux,SILK
watching thread fb possible future ux speaker crowd suggestions seem white american dudes dream broadly people,KOR
rt thepatrickwalsh kriss kross rapped try rhyme rhyme like rhymed jump jump,BSK
thelancearthur hotdogsladies realize anyone ever made dessert,KOR
wkamaubell stand want men telling sexist either people experts experience,BSK
frogtosser thank becca,BTM
deray thank,SILK
rt iamsakuma hundreds people union square march uptown via th avenue blacklivesmatter http co r x wzem j,BTM
leadership tech oths stop sound system front plaza disturbing neighborhood,BSK
infuriating oakland pd tell authority anything thing school would,RRN
best part heading toronto month hear school system councilmember dankalb ignored,BTM
oakland tech got stadium level audio going giant crowd ppl front skul ignoring neighborhood,SILK
twibnation grassroots media covering ground baltimore ferguson blacklivesmatter movement,RRN
rt camerontw fingers crossed need good news rt pkedrosky ben horowitz lyft investor says uber losing order billion,JNR
grandparents meet mine involved guy named mooch gluskin howigothere fb,SILK
rt ozchrisrock media gonna show pic baltimore citizen lining protect police http c,HSR
studiomondeo sticking mailbox switched phone weirding,BSK
joni mitchell joni mitchell joni mitchell,SILK
bowling alley japanese toilet seats surprise google today wait women bathroom,BTM
rt joshaclu question someone going rule marriage equality http co staktjvgsg,JPN
ellenpapadakis completely separate note,JNR
ellenpapadakis hey civ pro oregon bakery case,JPN
ellenpapadakis best thing world would get epc think,KOR
ellenpapadakis provided claim legit public policy exception thought state whatever wants enough,SILK
ellenpapadakis ancient recollection provided course nothing hanged always really ffand c,HSR
ellenpapadakis giving talk able listen read mentioned facts life,ATB
bookmeister studiomondeo nope thanks giving shot,ATB
finding mailbox either crashing hanging happening,KOR
jshahryar except desire design game called cocktail party worked bill gross first cd rom start,KOR
jshahryar game really enjoyed one much galaga added two buttons game forgot genre,BSK
scottjohnson keep em,SILK
joan rivers get mark twain award posthumously next year twainforjoan fb,RRN
sharkyl aw every nerd knows social cue miss used tech biz btw bandagon looks v cool,HSR
sharkyl seemed like maybe nice shook hand went ironically niagara falls ny,JPN
thxmt sharkyl heathr great set thur st time seeing talking guy actually sweet disablities handled great,ATB
sharkyl sad,BTM
lizgannes congrats,BSK
kenyatta jah justin show great made miss conversation great making inspiration,BTM
dearsarah already successful hero making strides upstart every woman every person bit go,JPN
dearsarah yup reminds streep quotes witw core challenge get men identify women protagonists,RRN
rt dearsarah heathr similarly though majority twitter bod graduate college hillary clinton initially consider,BSK
dearsarah reminds people responded idea female host tds already proven double standard limiting,BTM
burstofbeaden congrats jon,JPN
ripplecreeknw sprawlgeek disagree tech makes people behave badly responsibility lies us humans,ATB
twitter good enough history gender read way jlp heathr headline news facetious,BSK
believe hell hard find ugly feminist jewish,JPN
really twitter wrote encapsulation trend dickc ev rosenblattdavid karaswisher http co ushk wzp h,BSK
page interesting way world capital believes hack usefulness spiritual practice without spirituality,RRN
documentally maintenance change appealing,KOR
jenafriedman guessing hundreds something publicly spoken,KOR
picked another spectacular middle aged accomplishment slept night last night newsuperpower fb,JPN
elisac sprawlgeek privileging corporate liability shield politics positive connection responsibility,HSR
elisac sprawlgeek things together together erasure uniqueness,ATB
elisac sprawlgeek believe bigger broader older current tech biz core emotional issue,JNR
elisac sprawlgeek sustained value dismantling shared resources sense shared involvement ie public education,RRN
elisac sprawlgeek think lot problem big capital funds names know direction invest exits vs,JPN
sarahgranger elisac dooce makes life better business tech law medicine etc serve people reverse,JPN
sprawlgeek elisac mylifeasaghost ripplecreeknw cyberselfish book paulina borsook saw happening tech first,JPN
elisac saw women thing hollywood casting prove keep work,JPN
oy vey price elisac heathr hey selected booth babes booths act cool notproud,JNR
ripplecreeknw thanks v kind,RRN
elisac web felt clearly like people lots early women inc dooce early blogging pre blogging software v human,BTM
elisac really interesting early web times felt like liberal arts nerd table bonanza hardware mature biz ie booth babes,RRN
rt elisac heathr ah see traditional tech hardware systems internet early oughts super male dominated,KOR
elisac still part group called end humanizing capital laid waste impulses leading,ATB
elisac felt better woman coming early web valley bc women product hollywood,JNR
elisac mylifeasaghost wrote cyberselfish early saw impulse first right would rule,BSK
elisac general leftover hippiness still everything well feeling nerd table earnestness,KOR
elisac also culture sharing information ideas problem solving still felt w developers fluentconf week,JNR
elisac developers time time orientation education open people able use stuff,JNR
elisac well coming hollywood seemed entire notion platform meant people trying encourage,HSR
elisac earlier tech community felt full caring centre make healthiness goal scale,JNR
elisac choices connected substituting words choice freedom care,JNR
elisac one even insidious think going last longer upside downside shows dehumanization,RRN
elisac need giant relational reboot look like put well everyone work first inc us,HSR
elisac focussed amazing ux customers create good things critical creating fetish,BSK
elisac absolutely many businesses funded way presume obligation employees,BSK
rt elisac heathr makes concerned abt sharing collaborative economy economy unless change social appr,JNR
elisac otherwise building matrix entrap way use capital choice many see magically charge,RRN
elisac culture says shines tech support good life interested,BTM
great talks pinboard baconmeteor elisac heathr sounds like heaven lifestylebusiness,ATB
rt elisac heathr build business supports family maybe employees lifestyle enjoy proud con,BTM
rt elisac heathr agree whenever speak publicly abt entrepreneurism mention despite general disdain around term lifesty,BSK
elisac valley capital culture general seek scale else put good life community first,RRN
elisac sure also smaller scale work sustainable good life,SILK
rt elisac heathr well exactly like solo consultant lack scale exists business including one,ATB
elisac blogging mediums go away way use culture changes,SILK
elisac know seems like pretty specific thing limits individual personal blogging large audience,BSK
kottke tcarmody think made change public rock throwing happen would need treat better,BTM
rt afameducation congratulations first black female attorney general united states lorettalynch confirmation http,RRN
rt shannondowney little help folks confused brucejennerabc talking gender identity vs sexual orientation http,HSR
strong focused athletic competitive make man women gender make someone reckon,ATB
bruce jenner one example strong focused athletic women happily qualities restricted one gender,SILK
feminism ending restrictions based gender categories ending restrictions woman brucejenner,KOR
bruce jenner concept woman maybe already wrong woman,KOR
rt thetaskforce beyond bruce jenner transgender women accessed homeless shelter physically assaulted http,JPN
cannot feel known something everyone wants anything ppl come,KOR
coming time always vulnerable powerful kudos bruce jenner everyone else,HSR
case dying curiousity including one timer face yoselftweet fb http co ttjd k b j,HSR
found drive first tournament game california hockey championships fb,RRN
mt harnischfound likely survivor sexualassault drop college thn person found guilty expelled aelizabethclark,SILK
rt joan rivers joan nytimes bestseller paperback new material diaryofamaddiva joanrivers http co nk ghxnfg,JPN
single person looks good baggy wool cap barely clinging noggin fb,SILK
mattthomas apologies interrupting,JPN
mattthomas economic problems imo often extensions form dehumanization wrapped locke sandwich,JNR
mattthomas divide conquer persists unite someone else ass,KOR
mattthomas like us thriving democracy every everyone first nations people,BSK
mattthomas plenty thriving democracy cathart onto minorities ways diffuse real economic problems,SILK
mattthomas know going holocaust museum berlin made pretty clear boom maybe yrs coming,SILK
thejeffdavidson kthalps debs historic,SILK
benjammingh sf minimum wage,JPN
paid park hours mission show fb,BSK
rt sherman alexie number hours per week rick santorum spends deeply thinking gay men,ATB
peterc thanks peter,JPN
annehelen idea happened walk sandlers film v interesting find,BSK
annehelen think problem punching case even aware using someone punching bag,ATB
jenafriedman share sentiment oy headline asked getting started advice always suggest watching bad open mics,KOR
caseymalone pleasure took years dawned feeling good person part damn therapy,SILK
caseymalone toll asking minute free meetings feel whether comfortable w space,HSR
caseymalone really dejecting good place disappointed reach decrease,RRN
caseymalone casey give liking provider critical care good,JNR
yesterday crowd work javascript coders today comedy chabad codeswitch fb,KOR
weezus love,ATB
clevejones grateful work alive xo,BSK
amoskane thank fun talking thanks lez dish enough javascript conferences,ATB
rt amoskane omg met heathr fluentconf real freaking heather gold freaking heather gold glasses everything omggggg,ATB
thejeffdavidson thanks himand morning joe copying us pretty good kthalps,SILK
fluentconf thanks help josh great meet,HSR
rt fluentconf st meetup rocking start talking react w holtbt heathr community lounge fluentconf http,ATB
tummeling react meet fluentconf really fun helping people solve problems fluentconf fb http co p h spthr,RRN
hillary hey introducing zahedab us fluentconf digital gov work uk would love meet f,ATB
rt peterc heathr fluentconf retweet,ATB
pleasure finally meet kathy sierra person much talk new book looks fantastic fluentconf fb,KOR
hi everyone fluentconf looking forward meeting today say hello want talk fluentconf fb,ATB
residence fluentconf next two days making interesting conversations happen looking forward seeing kathy sierra,JNR
like reo time fly fb,JNR
look forward commercials movies attractive man romantically excited bud light dog animated cuddly bear,HSR
thanks jim cool spot show thanks jimhegarty heathr zachsherwin thanks much show great set,BSK
happy set la tonight nice words sean patton many thanks zachsherwin jimhegarty ftstweets fb,SILK
biggest disappointment latimefob writers giving standing ovation actor writers fb,BTM
lovely time burstofbeaden thanks mirand,JPN
guys got tell roz chast loved book really beautiful drawings mother dying remarkable fb,BSK
buzz sounds right maybe people la find oklahoma restaurants large marfa,KOR
rt goldsbie lakoff short respond bullshit questions statements reinforce broader premises,BTM
buzz ha anyone think travelling nyc,KOR
rt hoserlibrarian heathr spend even less time listening u,BTM
could get back appreciate wham lot fb,JPN
downtown la beautiful lived came cafeterias occasional friend visit warehouse fb,ATB
coming sf la restaurants taunt hugeness space matter jog restroom,JNR
vivalacho remoteryan marikotamaki glad one could make fortune renting rooms steak bed razor blades,RRN
guys want fall asleep second finished meal remoteryan vivalacho marikotamaki,HSR
public service announcement lose loose different words,KOR
rt morningjewshow please send good vibes mshaberach spell kthalps uncle ricky,JNR
please announce residence fluentconf helping interesting conversations connections happen props peterc fb,RRN
bagel lox airport traitor people fb,HSR
bagel lox airport traitor people fb,JPN
rt peterc sarasoueidan positive great stuff heathr expert great google tech talk slightly fan,HSR
silicon valley make recommendation clear fiorina running presidential nom based business record,BSK
rt malouie hillary clinton looking ux designer heard right message interested http co sqjactw u,HSR
la performing french toast comedy taix sunday night fb,KOR
hannahnordhaus sorry able make yesterday hope reading went well see reunion,RRN
know email spammed fucking gall asking enter get rid everyotherlist fb,ATB
latimes festival books morningjewshow fans interview possibilities let know think good jews,JPN
sarahm thanks passing dearsplenda piece much experience uncomfortable jonronson,BSK
rt ppact pm est join us twitter storm say need equalpaynow better http co z,KOR
last tweet via jeremiah wallace,JPN
kithonline love tour photo hoping means one banjo number bomb pic,HSR
debcha dealing ivy league alma mater th reunion class central really shameful,ATB
rt lauraclawson serious cuteness team hillary http co idg aqbxkh,ATB
monstro course,RRN
monstro pleasure would love audio interview important fan flames honesty,JPN
yvesbehar remember,BSK
lukedanielswpg welcome,ATB
worth checking last chunk monstro timeline start founder realness especially think raising means,KOR
special occasion americans look away find leadership alternative hillary clinton video fb,RRN
sukhjit zoning anagram requirement,RRN
bay area going kithonline also admire tour photo great david hawe,JPN
dweinberger feel like person best chance beat also husband,BSK
rt evilllamas http co dukj yilrn,HSR
hillary diversity terrific like fast furious political announcement ads,ATB
jessicachaffin working tuchus latest ronnaandbeverly w least helpful interviewee ever heard,HSR
benschwartzy sadydoyle yeah feel like linked much masculine anxiety vulnerability fear emotion,BTM
dweinberger thrill consider first woman president also know problems us facing need radical soon,BTM
dweinberger counting gop maintain unlike ability increase,JNR
rt sadydoyle boy howdy looking forward wading liberals creepy unacknowledged neuroses female power th,HSR
timoreilly pahlkadot mazel tov guys,SILK
rt changeist heathr point contained traditional duopoly future unitary parties,JPN
changeist maybe something seems unforseen happen,BTM
changeist gop base though libertarian politics amplify poverty problem think dems go,HSR
big hilary clinton question moment win looks inevitable willshescrewitup,HSR
changeist think us politics may begin look much like israel internal politics christian religious population,ATB
changeist also think tax billionaires naive candidates population think control,SILK
changeist big libertarian money though like w cruz keep funding religious theocracy think culture war also distraction,JNR
changeist guessing see tech workers w good jobs making good money able afford live sf,BSK
yup feel ironically thing ends shame openness changeist heathr nobody wants talk shame,HSR
changeist something butch say street life making tough market dorothea lange would called whiner,BTM
changeist seem like hold vulnerability economic loss seems like forbidden topic public,SILK
changeist yes economics situation keep folks investment busy anything afraid survival employment,SILK
changeist without class movement limit fascism,KOR
changeist gop citizens united billionaire candidate buy direction lead meaningful class movement,BTM
rt theferocity job women writers color teach straight white men read diverse work read wor,RRN
rt heerjeet cruz plus sugar daddy potent combination ostensible frontrunner jeb bush vulnerable host reasons,RRN
rt heerjeet long term though cruz ascendency bad dems gop push american politics even h,HSR
rt heerjeet short term cruz ascendency great news dems make gop toxic national level amp insure hillar,KOR
rt heerjeet line cruz always imagine joseph mccarthy goldwater twice iq points dangerous man,ATB
middle age spending saturday cleaning bookshelf receipts feeling like goddamned genius thebardrops fb,BTM
happy end passover everyone san francisco plagues http co x jvy,JPN
rt newyorktheater tremble whole life rehearsal moment rip livingtheatre judith malina http co,RRN
rt feldmanadam patti lupone bridgeteverett hall oates motorboat best seconds history http co vcwzkipgyt,ATB
wish fallon show would kill min every guest bit line reading next spontaneously,JNR
heard human quacking realized duck boat pulled next light fb,ATB
billmckibben worked african divestment yale though took sometime,HSR
one gives ronaldoca heathr seriousness jewish deli worth salt open passover http co pbpq iuanf,RRN
jewish deli watched guy order mayo fb,KOR
steverolston thank,JPN
melissapierce aw marikotamaki morningjewshow,BSK
interviewing sweetheart writer marikotamaki morningjewshow right questions,JPN
dated since moved phone apps good incentive make relationship work fb,RRN
rt timcarvell unsolicited advice get tickets fun home say saw every prize,JNR
barsoomcore congrats corey,BSK
simongdunham really important piece could get accurate count wonder ge country sick way,RRN
know kaporcpital therealfreada mkapor unusual commitment think trend w vcs like design design partners,BTM
keep yr name clean wb guru still amazed delasoul raised k days asking k respect lasts forever,HSR
bruces thinking quite often days every time hear tech scion mention universal income,HSR
debcha canadian,JNR
rt sandmansimonds art exist confirm understanding world,SILK
unexpected far seem seems come part present enjoying piece filmmakinglabs one day study w,BTM
began experimenting w making interactive pieces tummeling found unexpected engaging conflict cc filmmakinglabs,SILK
night good people fb,KOR
wonderful seder happy pesach easter night good people liberation seems like inevitable suffering fb,SILK
rt itswanda even democracy become irrelevant capitalism longer needs democracy function zizek,BTM
regret abt living oakland living next oakland tech high plays stadium level music outside weekly kids,HSR
children assembling white house lawn afternoon hunt afikomen happen monica lewinsky president,SILK
water shortage like hiv epidemic searing reminders connected isolation option fb,BSK
liberty justice lieseveryonetells fb,BTM
oh shit curses coming every entitled dude bay comes end orders unnecessarily complicated cocktail thelex,KOR
backs profiled tech guys cause wearing betarand shirts tucked salmon coloured pants thelex,BTM
want straight people know feels like wait work search room stand around people like fb,HSR
tayhatmaker making regret write queers queer life years write enough,JPN
tayhatmaker recorded lexington archive project,KOR
tayhatmaker possible room feel time city still dangerous,SILK
tayhatmaker first closing events probably last time many years dancing head,BSK
periscope moving tush finally get iphone change os plus regular unlocked contract recommendation fb,JNR
ashedryden thanks,SILK
earthquake small shakes north oakland fb,JNR
nrrrdcore genuine confusion desire discomfort believe building emotional skills core making better,KOR
nrrrdcore find ways make shift huge one beginning edge many tantrums,BSK
nrrrdcore truth get better earnestly connect w desire like folks couples counseling,ATB
nrrrdcore think wise one reply policy w men gender online one comment reflects savvy,SILK
nrrrdcore questions statements bullshit attempts reframe thus ignore said first place,RRN
nrrrdcore originally said powerful nerds chicks included default answering questions directly even,SILK
nrrrdcore thing without emotional awareness skills know anything moves forward guys go around,SILK
nrrrdcore yes desperate attempt someone weak emotional skills self awareness,BSK
nrrrdcore reminds chick takes aside grade tell telling people hate cuz cares,JPN
nrrrdcore statements reflect reality still tactical mistake,HSR
nrrrdcore really common always couched intellectually savvy tactical advice issue rarely intellectual,HSR
rt nrrrdcore heathr also threatening right like want enemy psssh care,SILK
nrrrdcore pretty common response eh smart weird care taking negging,BSK
jenkirkman virgotex see comedy boys outraged recent outrage dump lenadunham,HSR
ashedryden lizhenry would love speak alterconf best place email,BSK
marikotamaki thrown toy terminal toronto reg toy store kissing gay stores pull crap fb,KOR
jboxt guess lgbt dating start advertising organized anti gay work,RRN
rt jboxt heathr lds advertises playbill book mormon,HSR
eireanndolan thank oakland lesbian great boring best make game,RRN
frakintosh pretty interesting timing going clear broadcast book launch projects reem,BSK
anyone else getting scientology advertising kind amazing feel going clear help recruit http co wqqllqb rr,SILK
tiffanyshlain imagine either would want job much enjoy,HSR
coulda followed every jon stewart joke hosted tds might felt way abt lenadunham trevornoah,JPN
night good people fb,BSK
carrieffisher times day weeks make real sense bravo performance liberace,SILK
mediachick watched well done alex gibney films always leaves feeling cruise travolta maintain status quo,BSK
dubbed language machine learning cloud computing could david miscavige rallies could rubble tech conferences fb,BSK
rt jonimitchellcom joni currently intensive care la area hospital awake good spirits updates come w,ATB
susie c absolutely radio programs video shorts need price needs quite different,BTM
going clear pretty great wondering following travolta cruise bombshells drops fb,KOR
tomcoates gay big big gay also bears,JNR
big gay kind like costco bins kale incense quinoa fb,KOR
love hearing kids neighbourhood play outside though sure amazon develop button fb,HSR
amazon got cents vote slammin democracy matter weeks fb,JNR
rt rachelsklar sally asked rabiasquared abt white priv needed somebody good job hold whiteness,RRN
rt jackieosterrod please rt uber uber support losing b c account hacked locked hacker amp uber p,SILK
hchamp canadian password,HSR
documentally means new kind talk makes event moment record youtube,BSK
rt documentally great skype chat heathr thinking delivering kind double header event somewhere lt,SILK
jackson family said anything new law home state indiana fb,HSR
mattthomas wonder happened car makers horses,BSK
rt pinboard know holacracy truly works even lowliest janitor zappos threaten fire everyone reading,BTM
oh cool guy wearing security baseball hat said interviewing girls marketing jobs fuck diversity matters,KOR
grrl thanks good service came,HSR
rt elonmusk major new tesla product line car unveiled hawthorne design studio thurs pm april,JPN
anyone glen park neighbourhood able come give car jump right red car next bart fb,BTM
rt chrisrock thank president obama http co pgfjccyrta,JNR
sportjules thanks,RRN
night good people fb,JPN
musingvirtual katebornstein sorry hard sending much love,RRN
katebornstein talking workshop show tonight,BSK
many brave souls standing lena dunham surely means never see another holocaust fb,RRN
never gentile people decide tell anti semitic life fb,JPN
feeling really good creating space owning loss honestly public everything subject change coming along eistc,KOR
great everything subject change workshop tonight interactive shows surprises tonight cat bit show fb,BTM
sportjules thanks julia part seder performing today citywinerynapa thx nice words make blog post,SILK
thanks citywinerynapa fun performing seder today always fb,HSR
k costing first born sanfranciscoplagues,SILK
gay people leaving dance,RRN
water drink coffee entire generation said fuck politics going perfect coffee,BSK
sun worry water come whole foods sanfranciscoplagues,JPN
condo infestation even vineyards immune sanfranciscoplagues,JPN
salted caramel ice cream waiting line hours eat used called communism sanfranciscoplagues,BTM
gluten sanfranciscoplagues,BTM
selfie stick never need talk another stranger person sanfranciscoplagues,SILK
everybody gets iphones need nothing else sanfranciscoplagues,RRN
happy pesach people plagues san francisco small plates restaurants suck fine,JPN
sandyanne member tribe,BTM
sandyanne also totally honorary mot,RRN
sandyanne napa valley good wine audience getting happy,SILK
sandyanne thanks sandra seder show glasses wine instead,HSR
night good people fb,ATB
thinking thinning twitter feed sherman alexie,JNR
rt sherman alexie conservative parlance job creator means rich enough hire people amp pay better hides cash oversea,ATB
rt liberationnyc everything wrong nyc summed one photo eventphotosnyc friday night eastvillage evgrieve http co,BTM
dunham piece done phyllis diller husband one would care philip roth jewish girlfriend,BTM
wait see blogosphere haaretz time etc react next jewish mother jewish wife joke predicting crickets,HSR
tristanshouts thanks,RRN
thankyouellenpao early valley job colleague studiously avoided sharing contacts introductions vc,JPN
kleiner battle lost war except long run diverse honest investment field better,KOR
ekp one tough cookie thank,BSK
thejeffdavidson kidding,JNR
rt caseymalone heathr hire woman sues us think time take crush court,HSR
suzisteffen thanks suzi kind,BTM
thejeffdavidson morningjewshow chopped liver kthalps lenadunham babe,KOR
mt thejeffdavidson heathr morningjewshow many wmn intense love dogs comparison necessarily insult kthalps,RRN
