text,place
ibogost laurakipnis surprised campuses went dating approach bc liab ages ineffectively dealing w problem,KOR
ibogost laurakipnis kipnis thinks students today like answer problem,HSR
second umairh recommendation please read matthewstoller twitter essay recent stream small biz destruction greece,ATB
rt umairh strongly rec read matthewstoller weekend tweet storms agree one serious thinkers politi,ATB
rt matthewstoller basic shape requests words get rid corruption wipe civic secto,SILK
rt melissapierce think white men board unconscious bias think lazy stupid karaswisher,BTM
ani difranco judy garland lesbians era lesbians met next morningjewshow ep fb,BSK
know like try network business w vc founder met inappropriate sexual crap watching ellen pao case,JNR
brainpickings never forget wonderful hands sounds like affair flirtation,SILK
losertakesall llama wearing gold dress llama showy,KOR
pretty sure us could go war show upper right news headlines facebook unless kardashian involved,JNR
r bl rd llamawatch,BTM
r bl rd arrange llamas winamp,SILK
response get netneutrality question rt paulschreiber heathr four million comments,RRN
fcc ruled net utility phew surprised relieved someone explain corruption get,KOR
mattthomas please,JPN
thinking jimmy fallon goes home tapings puts joni mitchell blue nin takes sylvia plath,ATB
dearsarah moral gtd,RRN
chrisgeidner bring bowers anymore cc ellenpapadakis,KOR
winning joy discrete purity cannot replaced anything else bart giamatti fb,ATB
rt yokymatsuoka time nest incredible amazing team excited join flock twitter vp technology,SILK
elonjames love see gay men get involved feminist organizing problem asking asked straight folks marriage,SILK
elonjames got impression impulse course say meant said critiqued,ATB
elonjames speaker gets men love women romantically say whole sentence coherent probs,BTM
elonjames seems someone starts women men love women gay people impulse say gay people bc,BTM
elonjames yeah talking read start dismissing critiques trying follow,ATB
elonjames lgbt rights subset feminist movement civil rights fighting discrimination based restricting gender swimmamum,SILK
elonjames begining sentence women men love women gay people,BSK
elonjames read mention gay people way inclusive saying women men love women swimmamum,KOR
noakushner lululemon story disturbing bikrams guess anything people look salvation attracts opportunists,RRN
dougmcgray calsunday pretty come packaged breakfast nook indirect ray sunshine,HSR
mallelis always tell sports bar dudes fuck someone talk feelings get back,HSR
rt om mobile accounts youtube watch time overall views jpmorgan mobile stats goog http co lz,BTM
rt iyanlavanzant love simple make hard trappings expectations demands,BSK
michellequinn ooh get spare day tempted join live tweeting pao v kpcb would blast,RRN
fast click short attention web ie facebook buzzfeed driven capital investor demand much tech,RRN
quince find answer hamentaschsen question,JPN
rt jenashtep http co ctuezz u p,BSK
rt ibogost heathr anildash two unicode char wide aggregates made original race modifier,BTM
anildash maybe change iphone contacts icon still desktop dude phone ios gender,KOR
anildash bad news look like female equivalents hope wrong emoji osx,HSR
tomcoates thanks convo,JNR
tomcoates relying inequality many kinds esp immigrant labour unpaid work,RRN
tomcoates subversive challenging harder time finding public footing bc systemically whole thing,HSR
tomcoates like wag fingers middle east without looking mirror think economic issues way,ATB
tomcoates races sexualities need focus wage equality need badly true disgrace us,JPN
tomcoates listening entire comments context movie poor women single mums elderly women,HSR
tomcoates numbers insane people mostly privilege sense looking pattyarquette tweets,JNR
tomcoates women rights gotten separated degree think debate pretty alive tech hollywood stuff,JNR
tomcoates recent popular focus political success makes sense course separate everything perfectly,JNR
tomcoates huh hear solved say easily read though seems accurate,BTM
tomcoates tomcoates genders got lot,JPN
tomcoates lesbian bi womens issues routinely given short shirft various reasons including face way fewer us,HSR
tomcoates historically difficulty organizing way round beginning never ending acronym happened bc,RRN
tomcoates disagree,RRN
tomcoates going generous im open critiques,SILK
tomcoates larger point wage equality continued wd gay movement wo feminism think separated,BTM
tomcoates end day kind moment give chance public learning also hope,ATB
tomcoates phrase began women american includes women colours lesbians trans women anyone ids woman,ATB
tomcoates yeah problem agree w critique sure,ATB
tomcoates queer struggles gender struggles,JPN
tomcoates queer beef w statement oddly sounds like kind alternative kobe beef,BSK
larger call equal rights amedment wageequality women hope picked worked,JPN
addressing race wage inequality feed mean critiqued means sure,JNR
neither intent said women america men love women gay people pattyarquette,JPN
yeah critique made stuff get lgbt beef far see patriciaarquette,HSR
twitter short write full watch speech arquette intent looks inclusive gay men inclusive,KOR
rt billdixonish really bad place musical culture super surprised pop stars sing songs,RRN
yayfiona thx tip,SILK
thought average movie job breakdown days rt nelson waxpancake boy smurfs girl smurf reality grim,JPN
katelosse thing post willing print op ed woman responding wadhwa,RRN
rt desusnice african american sniper would great sequel solve ton problems next years oscars,BSK
rt brendohare saw neil patrick harris suitcase bit oscars knew wanted comedy biggest comed,BTM
era night good people fb,BTM
skeskali jbrotherlove webinista look statement presume give shit abt anyone look like,HSR
skeskali jbrotherlove webinista one cd look call intersectionality men kinds work equal pay wmn,ATB
skeskali jbrotherlove webinista woman colours need deserve gender equality worked many movements,RRN
skeskali jbrotherlove webinista know sister trans right think language sloppy generous reading wd,HSR
unexpectedly political oscars still managed amazing amount obvious closeting domestic abuse presenters fb kthalps,ATB
travolta wig gonna get beards fb,RRN
rt lauren galik think said criminal justice system oscars obama state union address,SILK
rt julieklausner travolta wearing chain bottom using connect scrotum weight belt,JNR
rt followernodad want maria bamford host oscars,JNR
rt walterkirn hollywood proved tonight racist attempting prove far many times theoscars,JPN
rt hemjhaveri people losing shit patricia arquette saying women deserve equal rights like low rig,JPN
harold ramis thanks ashley glad wrong nothisisashley heathr last year,ATB
rt kathygriffin john travolta stop hugging people someone going get caught necklace,KOR
rt kimmasters barclaysaul kimmasters harold ramis either,SILK
rt phoenix atl wow wtf u going acknowledge joan rivers academyawards shadeattheoscars http co lz kdd c,BTM
rt poniewozik would love hear joan rivers routine getting left memoriam reel,BTM
rt dearsarah actuallynph st oscars host consistently amp comedically sexually objectify men amp rather focusing,RRN
rt timfederle taylor negronactor http co r eslpckq,JPN
caissie directed rabbittest totally wrong,BSK
rt puddinstrip taylor negron cut memoriam make room neil patrick harris underwear bit oscars,KOR
rt realleadelaria elaine stritch montage wtf,JNR
rt mashable pattyarquette another award speech http co bqgjczkgx,JPN
rt melsil women film business know work insanely sexist industry takes serious guts call,RRN
rt ryanghinds heathr look talking serial mom muppet take manhattan wtf,BTM
rt motokorich pattyarquette called clean water around world,KOR
rt mmflint god bless patricia arquette great actor brilliant citizen admiration millions much love,BSK
rt biancaconsunji fuck yeah patricia arquette,BSK
rt officialjld yup pattyarquette,ATB
rt cd clifford gotta trend pattyarquette instead patriciaarquette give love straight,JPN
rt pattonoswalt patricia caused streep jlo voltron doomed oscars,JPN
rt markennis carried http co tmnbc lsg,BSK
mulegirl gif goes right default screens,BSK
rt mulegirl ok patricia arquette brought globes level madness meryl streep right gif use slac,BTM
rt annehelen quite articulate much patricia arquette speech meant effectively amp concisely use platform,RRN
rt rgay love meryl jumped ride die,JPN
rt jsmooth love patricia love speech wonder anonymous oscar voter thought patricia speech also stirring,KOR
rt smrtgrls screaming screen pattyarquette speech incredible could imagined wageequality,BTM
alicetiara tomcoates victoriaastacey disagree w guys one great character unfinished script weakest lasseter backed film,SILK
tiffanyshlain meshugenah equal pay enough ppact pattyarquette oscars,SILK
rt tiffanyshlain cried speech ppact pattyarquette time wage equality equal rights women america,HSR
rt emmaladyrose patricia arquette swooped oscars like sexism fighting vigilante,RRN
rt thesamhita know better patricia demanding equal wages women meryl reaction oscars,ATB
f x thank,RRN
rt bookbrats gifed http co sfamqkwgbw,BSK
big hero crappy unfinished movie deserve sure marketed best oscars fb,RRN
rt rgay accept oscar equal rights women equal pay comfortable bras,BSK
rebeccaodes fuck yeah hair week messy ponytails,ATB
rt rebeccaodes yes yes yes patricia arquette messy ponytail reading glasses call revolution oscars,ATB
rt coreythrace making use time benefit rest us thank patricia arquette oscars,BTM
rt kathlanpher could love patriciaarquette want gif meryl streeps fist pump oscars,SILK
rt annehelen fucking patricia love,RRN
rt janegrl inc wage equality love patricia arquette oscars,ATB
rt elissaschappell yayayayayayayayayayayayayayayayayayayayayayayayayayayayayyayayayayayayayayayyayayayayayayayayayayayyayayayayay patrici,JNR
sandymaxey know know,RRN
rt capehartj patricia arquette accepted party nomination president oscars,SILK
rt rachelsklar time wage equality amp equal rights women united states america patricia,SILK
rt ladypjustice time wage equality equal rights women united states america patriciaarquette oscars,BTM
sharing feminist feed blowing pattyarquette love time equality,RRN
rt annehelen ethan crying love,HSR
rt lizzwinstead patricia arquette drop mic oscars,BSK
rt sandrabernhard go patriciaargquette let revolution begin fantastic feminist rant brilliant,BSK
rt estherbreger need gif meryl streep jennifer lopez cheering wage equality,BTM
rt neginfarsad patricia arquette presidential nominee oscars,JPN
rt dorothysnarker ok fine watch csi cyber feminist realness served lezwatchoscars oscars,JNR
rt melissagira loving everything patricia right earlier talking eating bark,ATB
rt karenkilgariff fuck yes patricia arquette get feet white shits,ATB
wild deserved nominated best film saw year laura dern breathtaking,RRN
sandymaxey wait real joke hit reality,ATB
music promises kelly mcgillis take breath away ask lesbian lover making jams jellies ptown,JPN
rt mattthomas bradley cooper thing people treat actual veteran,JNR
emilynussbaum clue shout amazing putting gay writing team,ATB
hey hired chorus oscars fb,HSR
sf e bay pals want witty lesbian oscar watching company,BSK
rt ianbremmer muslims link hands ring peace around jewish synagogue oslo best news europe year http co cns,KOR
oh hand therapy country much packaging fb,KOR
libbyformayor success supe dankalb trying deal w ongoing noise oakland tech prob anyone else suggest,BTM
sethrudetsky emilynussbaum inviting morningjewshow together separate choice dm set game,JNR
mallelis oh yeah bring jumpsuit back rouge cheekbones hard,JNR
desertfan thank lovely company,RRN
mjb sf rodbegbie would room participates includes assigning editors marytrigiani,RRN
ninavizz lot variance bunch people also see see spreads spreading changes joined reality gaslit,KOR
ninavizz gaslighting requires narrative conformity takes one enlightened witness cite alice miller help feel sane,JNR
ninavizz quite exciting thing torn pure comic anthro takes time dive tomorrow,ATB
indications winds blowing ninavizz heathr public private breaks gale wind snuff gaslighting bring,KOR
ninavizz unsure feels unfair last tweets start pondering larger context around thing,HSR
ninavizz talking way communicating conditions used changing w dhwa todo shows,BTM
ellen pao suit v kpcb may noodle much larger w dhwa moment instructive,HSR
patriarchal shmutz valley stuff relies public private split old notion authoritah cracking,ATB
small w dhwa debacle gets public private shifts feminism set ground work means many pov harder control official line,RRN
like katelosse technique spelling w dhwa want explore stuff making pieces possible systemic bit,KOR
rt marshallk know twitter exist build really good blog search engine,HSR
aminatou yeah heading interesting moment maybe condescension women deal w regular bit clearer,JNR
every woman married guy fame parenting expert,BTM
nice stand set little bit kurt amp mike packed house haight full v polite millenials thanks v much fb,SILK
shailadewan posting coates fave writer read online every sentence meal easy read amazing,KOR
narrative elegant trojan horse daring radical ideas could explode storm great city tanehisicoates,BTM
stcymsn ask bonhamcentresds scholarship bdsm kink consent cc dearsarah,BSK
dentists half nose numb make interesting morningjewshow fb,BSK
sarahbeee interested project like include presentation pitch coaching would interested participating,BSK
guy class wait martin short host ask permission take idea half wits sctv big news,JPN
best part normmacdonald brilliant tweets precise storytelling great comedy lessons jeopardy sketch,BSK
sure seems theres closeted weirdness yes cosby deserves kinds condemnation none anything w murphys comedy call,HSR
think comic decide eddie murphy one best think know better,JPN
salon etc decided comedy geniuses need tell eddie murphy comedy choices make,KOR
rt niccagematch one movie ever coughed lived,JPN
benjammingh tayhatmaker odd lifestyle choice need protect children,SILK
heterosexuals going asked account shades grey movie,HSR
jordygold cool,RRN
rt katiesimpsonctv release toronto police officers charged sexual assault gang sexual assault http co f vdbuyvv,ATB
rt worldstageto yes harbourfront centre theatre audience exploring set installation object lesson http c,HSR
lgbt employment protection news huge thanks prof sylvia law feminism approach came hope upheld,SILK
rt scottjohnson recommend reading today tweets normmacdonald nice snl behind scenes happening,RRN
normmacdonald great storytelling great rhythm thank,RRN
rt normmacdonald created half dozen perfect comedies work ethic remarkable taste never taking answe,KOR
rt normmacdonald mike myers incredible work ethic joke ever good enough must beaten must beaten,JNR
rt normmacdonald without perfect take trebek maddened outright hostility connery faraway uninterest burt,RRN
normmacdonald class,BSK
night good people fb,BSK
rt mulegirl hey working new project need help see notable example interface copy great awful send,SILK
rt ethanz incredible finding poptechworks rds women living sro hotel troy ny working tech industry,JNR
rt girlziplocked woman founder sexualized vc want talk podcast dm,SILK
everyone get burning man tix spent week working together feed homeless folk sf cc joyce,BSK
ddukes boo,HSR
rt ninavizz heathr less college wunderkind dropouts recruited mostly white male droves participate accelerator programs,BTM
rt k heathr first lulz,KOR
think silicon valley becoming less environment emotional maturity really curious hear fb,SILK
keating mazel,SILK
ayeletw tempting,BSK
rt adriarichards whoa never thought see twitter survey abuse harassment online http co wnuoxfo v,RRN
medialab mit joi sorry loss also hope school stars calling dustin smith partner partner companion,RRN
space helmet perfect sound face staring blackness sang science fiction df fb rhps,SILK
vinodsreeharsha thanks vinod,HSR
kevinlferguson read,JPN
go spacesuit fb,JPN
joyce idea know monks st anthony know whole lot wonderful,BTM
joyce imagine homelessness sf everyone home known others cared,RRN
joyce would like see tech developed w question mind helping us get closer world farther,KOR
joyce work backward listened rabbi talk last night actually bold believe,BSK
joyce expert help spec would ideal situation everyone w adequate home food health care spec,BTM
joyce thanks thought question bike ride guess way design anything b w heart imagination,JNR
joyce early st anthony monks told us homeless folks sf imagine fewer,RRN
kevinlferguson believe simpsons mentioned book neither came convo ani difranco,BTM
rt harmonbrew hotincleveland sarahkendzior uppastryplate jenna bush today show even worse swear hire eva braun,JNR
rt harmonbrew hotincleveland sarahkendzior uppastryplate pay establishment wants hear chelsea clinto,ATB
rt mikevardy rt caspertek killer free app week starbucks http co bvwinrht,BSK
trying come good pm dessert place cozy hotel restaurant bar sf birthday tomorrow ideas fb,KOR
taped enjoyable morningjewshow convo mckenziewark encounter correspondence kathy acker,JPN
apple opportunity enter market make much bigger changes existing us car makers margin,RRN
lets face american car design sad bit excepting recent tesla changes,KOR
could start scratch w digital experience hardware software integration advantage ease margin,SILK
apple seemed like bit switzerland long could get past consent decree w apple records music,BSK
apple working music existing players industry seemed conflicted making ux biz model leap,ATB
apple would design car reasons ipod itunes worked precursor bit tony fadells start,SILK
rt johnfugelsang vegan willing come house make feel guilty life choices,JPN
heerjeet younger jews even left israel,SILK
rt heerjeet like godot messiah much anticipated jewish move right something always arriving never,HSR
heerjeet dreams,SILK
kevinmarks yes n america,JNR
ryanghinds end one really funny sad snl think heart head love,KOR
trinity snl http co hanoj gnlf,RRN
rt nycityalerts temp nyc single digits bryant park via maximusupinnyc http co bmruogj ep,BSK
think got cocks world kathy acker fb,JPN
ellenpapadakis went apparently see last rt,KOR
pouring one janeane garafalo wish snl,RRN
rt sarahksilverman bill cosby unconscious coupler,KOR
lorne michaels last guy job years fb snl,KOR
julia sweeney get moment snk,HSR
rt abbey bender pic gt snl http co pcuji twml,HSR
would watch show mike myers dana carvey snl,HSR
think anyone comedy influenced show snl,HSR
showed eddie murphy snl,JNR
jane curtin far still looks like person bless snl,KOR
playing kristin wiig mum californians,HSR
interested another private conversation gender man year one choose talk talk otr,SILK
dismissing women experience public places power common seen even happening norm,RRN
morning reminded gender gap life around understand common female experience huge,JPN
seen anyone feed talking jewish dude shot standing guard bat mitzvah copenhagen care bout,HSR
ignore yup yup thebreakfastclub ripjohnhughes,SILK
selfie sticks talking stranger apparently terrifying trusting memory experience fb,BTM
mattthomas response must surprise,JPN
mattthomas whoa straight people done away pubic hair awhile,ATB
rt susie c wonder deep satire fits age polarized sincerity far right amp left agree amp notice make fewer jo,BTM
night good people hoping last thought sleep love fb,BTM
ballet documentary worth seeing give much higher marks finding vivian maier though photographs incredible fb,BSK
xeni find sharing grief also part heals,BTM
larrybobsf thanks larry bob,RRN
mulegirl thelancearthur cannot fave enough,BTM
love love love fb,JNR
stealthissingul yes interview w ken wark monday book affair correspondence love acker tidbits,BTM
young people ask filmmaker writer tell look water fran lebowitz fb,BSK
motownmamao camille never walk away part npd picture lizzwinstead,JPN
lizzwinstead cosby numbers must high given already seen could almost start wire releases,JNR
stealthissingul hi ru,HSR
lived alone entire life idea accomplishment lesbian fran lebowitz f,ATB
ninavizz replacement announced yet,SILK
entertainment biz presumed women watch identify w male protagonists reverse possible ibelieved yet fb,SILK
daily show w yo males comedy central hire woman host corp presume demo move fb,ATB
prepping interview mckenziewark mon short love writing affair w kathy acker acker fans pls send questions,JNR
tiffanyshlain use password agile works well,JPN
rt wadhwa point demand podcast taken engage legal action asked reinstated co,HSR
berkun bingo almost everything industry changing world less would like afford admit,KOR
lenovo care hiring ambassador sexism tech unless goal marketing milashtonfan,BSK
milashtonfan certainly presumes supposed audience many tech co lenovo,RRN
dearsarah truth defense wadhwa,JPN
nothing pushed block people much podcast jewish stuff ask death violence wishes fb,BSK
idea would spokesperson jews seems incredibly goyishe prepping next morningjewshow fb,JPN
thing making impossibility writing anything funny funny check last tweet links lgbt,RRN
rt bijancbayne jbouie tanehisicoates reilly giuliani say blacks never discuss social ills accountability know,SILK
ameliagreenhall think also failure laziness media events work really examine issues beyond,KOR
also right wadhwa pieces tech industry fixing diversity problem much meaningful reporting,JPN
ameliagreenhall wish also covered large publications media conferences going expert,RRN
rt dearsarah npr amp tldr caved wadhwa childish threats amp helping silence women asked years stop,BTM
night good people fb,ATB
rt benjaminnorton gathered vigil tonight chapel hill honor muslim americans killed chapelhillshooting h,ATB
weezus also spent high holiday sermon laying attacks gaza purely wrong unjewish,KOR
weezus seems really mean say condescend incredibly smart inclusive willing,BSK
rabbi awesome sentence never thought write,BTM
succinct oh corporate works enables rewards mental illness fb,JNR
rt neb wait facebook graph search frikken gone slurping info structuring giving back,BSK
sure misremember work journalists fact checkers paid pay attention say brianwilliams,JPN
alexismadrigal interested knowing subvert subvert etc,KOR
cameronesposito pesticide ridden might use,BTM
arsetechnica would stop funny seconds,ATB
anyone upset uma thurman face change write produce script middle aged woman fb,KOR
rt ihatejoelkim personally ready gay president yet mostly prepared get asked know every membe,JPN
rt cameronesposito believe wasted high school boobs men,HSR
want listen regular political comedy show hosted women subscribe morningjewshow host w kthalps,JNR
rt ruthannharnisch morningjewshow thedailyshow nu,HSR
morningjewshow jon stewart replacement next choice margaretcho would awesome fb,RRN
marikotamaki xo dirtbagg,RRN
rt morningjewshow bat mitzvahs willing discuss possibility thedailyshow cc ruthannharnisch,SILK
try determine speaks jews morningjewshow taping jon stewart announces dailyshow retirement coincidence,SILK
working next morningjewshow guys shandehs bumming much need recent mensch good jews,ATB
mattbors solo performer comic love way illustrated storytelling approach gives journalism power thanks,BSK
susanorlean one need bmi sesac license sec planning upcoming morningjewshow,ATB
ken goldberg response uma thurman new looks seems pretty uncanny valleyish think applies,RRN
rt thejeffdavidson morningjewshow heathr jew speak one person possibly speak jews happily l,RRN
susanorlean know needed make sure rights cleared music podcast,HSR
rt morningjewshow netanyahu decided going speak representative entire jewish people speak,JPN
best broadcast interviewer know kristatippet check beingtweets podcast,JPN
nje distance fentons love place swell deserves word,KOR
never imagined pizza would mean much fb,SILK
toddlers circle taking turn middle grooving family special song cooldaycare fb,JNR
night good people fb,SILK
rt zefrank individual comprehend network node something complex,HSR
rt ditzkoff thought could get something waffle house secaucus would melissa rivers accepts grammy,BTM
rt jenperos joan rivers awarded posthumous grammy best spoken word album diary mad diva watchwithus,RRN
tanehisicoates less prone projecting cause emotional pain onto someone less power try feel better,BTM
ellenpapadakis thanks ellen actually cool interesting see work next show wish still videos,JPN
oh brave thing want hear white man say wrong fb,HSR
sadydoyle primary question business everything value beyond marketing manipulation,JPN
rt sadydoyle primary question culture crit next years whether value journalism also mark,RRN
escapist good health sending good vibes tell us hat day send worked mine,SILK
owenthomas sure delighted next host cook new one,KOR
owenthomas selling fey,RRN
got gay divorced long island heart goes rosie,RRN
wonderful rare experience today kind stranger helped stayed called others need help,RRN
downstairs neighbour choose helping us fire game confirmed decision fb,HSR
rt jsmooth fyi facebook account shut today jay smooth name used publicly years,KOR
veen congrats trueventures,SILK
ianrhett listening youtube filling heart god love voice,JPN
ayadeleon congratulations,SILK
sign times medical office yesterday long generic questionnaire asked either female male genital surgery,BTM
