t_id,text
374,oh shit the curses are coming out every over entitled dude bay comes in her end orders an unnecessarily complicated cocktail thelex
375,they had their backs to all i profiled them as tech guys cause they were wearing betarand shirts tucked into salmon coloured pants thelex
376,i want straight people to know what it feels like to wait work and search for a room where they can stand around with people like them fb
377,tayhatmaker it s making me regret i did not write more about queers and my queer life all these years i didn t write enough
378,tayhatmaker it s being recorded lexington archive project
379,tayhatmaker it s possible in the room to feel a time when this was our city and when we were still dangerous
380,tayhatmaker it s the first of the closing events it s probably my last time here many years dancing in my head
383,periscope is moving my tush to finally get an iphone and change my os plus or regular unlocked or contract your recommendation fb
384,ashedryden thanks
386,earthquake small shakes in north oakland fb
387,nrrrdcore and there is genuine confusion and desire and discomfort i believe building emotional skills are at the core of making it better
388,nrrrdcore we ll find other ways to make the shift and it s a huge one we re on the beginning edge of but there will be many tantrums
389,nrrrdcore truth is that it can get better only when we earnestly connect w desire for that like folks do in couples counseling
390,nrrrdcore i think that s wise i now have a one reply policy w men on gender online and only if their one comment reflects some savvy
391,nrrrdcore when those questions and statements are bullshit attempts to reframe and thus ignore what you said in the first place
392,nrrrdcore what you originally said is very powerful but most nerds chicks included can default to answering questions directly even
393,nrrrdcore thing is that without any emotional awareness or skills i don t know how anything moves forward with those guys will go around
394,nrrrdcore yes and the desperate attempt of someone with very weak to no emotional skills or self awareness
395,nrrrdcore reminds me of the chick who takes you aside in grade to tell you she s only telling you people hate you cuz she cares about you
396,nrrrdcore your statements can t reflect a reality and if they do it is still a tactical mistake
397,nrrrdcore it s really common and it s always couched as some intellectually savvy tactical advice when the issue is rarely intellectual
398,rt nrrrdcore heathr it s also threatening right like you don t want me as your enemy psssh don t care
399,nrrrdcore it s a pretty common response eh you aren t being smart weird care taking negging
401,jenkirkman virgotex didn t see any comedy boys outraged over the recent outrage dump on lenadunham
402,ashedryden lizhenry would love to speak at alterconf where s the best place to email you
404,marikotamaki and i were thrown out of toy terminal in toronto a reg toy store for kissing because we re gay stores pull this crap fb
406,jboxt i guess lgbt dating should start advertising in their organized anti gay work
407,rt jboxt heathr lds advertises in the playbill of book of mormon
408,eireanndolan thank you from this oakland lesbian it s great to be boring here we ll do our best to make the game
410,frakintosh pretty interesting they re timing it to the going clear broadcast and the book launch projects that reem them
412,anyone else getting the scientology advertising kind of amazing they feel going clear will help them recruit http t co wqqllqb rr
417,tiffanyshlain can t imagine either of them would want the job as much as we d enjoy them doing it
422,if you coulda followed every jon stewart joke before he hosted tds you might have felt the same way as you do abt lenadunham or trevornoah
423,night good people fb
424,carrieffisher do it times a day for weeks for it to make real sense and bravo on her performance in liberace
425,mediachick i just watched it it s well done alex gibney films always are leaves you feeling cruise and travolta can t maintain status quo
426,if you dubbed in language about machine learning and cloud computing could the david miscavige rallies could rubble as tech conferences fb
427,rt jonimitchellcom joni is currently in intensive care in an la area hospital but is awake and in good spirits more updates to come as w
428,susie c absolutely same for radio programs and video shorts and if they need to own it the price needs to be quite different
429,going clear is pretty great wondering when and how the following travolta cruise bombshells drops fb
430,tomcoates we re gay too big big gay also bears
431,big gay is kind of like costco with bins of kale incense and quinoa fb
432,i love hearing the kids in my neighbourhood play outside though i m sure a amazon will develop a button for that fb
433,if amazon got cents a vote we d have a slammin democracy in a matter of weeks fb
435,rt rachelsklar sally asked rabiasquared abt white priv we just needed somebody to do a good job with this i can t hold her whiteness
438,rt jackieosterrod please rt uber uber support is losing me s b c my account has been hacked locked by the hacker amp uber has no p
440,hchamp and canadian password
441,documentally it means a new kind of talk that makes an event more than a moment to record for youtube
442,rt documentally great skype chat with heathr just now thinking of delivering some kind of double header at an event somewhere lt not s
443,has the jackson family said anything about the new law in their home state of indiana fb
444,mattthomas wonder if that happened with car makers and horses
445,rt pinboard we ll know that holacracy truly works when even the lowliest janitor at zappos can threaten to fire everyone for not reading
447,oh cool guy wearing security baseball hat they said they are only interviewing girls for marketing jobs fuck that diversity matters
449,grrl thanks we re all good a service came
451,rt elonmusk major new tesla product line not a car will be unveiled at our hawthorne design studio on thurs pm april
452,anyone in the glen park neighbourhood able to come give our car a jump right now red car next to the bart fb
453,rt chrisrock thank you president obama http t co pgfjccyrta
455,sportjules thanks
457,night good people fb
458,musingvirtual katebornstein so sorry it s hard sending much love
459,katebornstein was just talking about this in the workshop of my show tonight
460,so many brave souls standing up to lena dunham surely this means we ll never see another holocaust fb
461,have never had more gentile people decide to tell me what s anti semitic in my life fb
462,feeling really good about creating a space for owning up to loss honestly in public everything is subject to change is coming along eistc
463,great everything is subject to change workshop tonight interactive shows have surprises tonight a cat bit me during the show fb
464,sportjules thanks julia i did them as part of the seder performing today citywinerynapa thx for the nice words i ll make a blog post
465,thanks citywinerynapa it was fun performing at your seder today as always fb
466,the k costing of the first born sanfranciscoplagues
467,gay people leaving why dance
468,if there s no water i ll just drink coffee an entire generation said fuck politics we re going to perfect coffee and they did
469,sun no worry doesn t water come from whole foods sanfranciscoplagues
470,condo infestation are even the vineyards immune sanfranciscoplagues
471,salted caramel ice cream waiting in line for hours to eat used to be called communism sanfranciscoplagues
472,gluten sanfranciscoplagues
473,selfie stick you never need to talk to another stranger in person again sanfranciscoplagues
474,everybody gets iphones you need for nothing else sanfranciscoplagues
475,happy pesach people the plagues of san francisco small plates restaurants they suck you in only it ll be fine
476,sandyanne member of the tribe
477,sandyanne also you re totally an honorary mot
478,sandyanne it s the napa valley it s good wine and the audience is getting happy
479,sandyanne thanks sandra this seder show has glasses of wine instead of
482,night good people fb
485,thinking about thinning my twitter feed down to just sherman alexie
486,rt sherman alexie in conservative parlance job creator means rich enough to hire more people amp pay them better but hides cash oversea
493,rt liberationnyc everything that s wrong with nyc summed up in one photo eventphotosnyc friday night eastvillage evgrieve http t co
494,if dunham s piece was done by phyllis diller about her husband in no one would care or philip roth about his jewish girlfriend
495,can t wait to see how the blogosphere and haaretz time etc react to the next jewish mother jewish wife joke predicting crickets
498,tristanshouts thanks
499,thankyouellenpao an early valley job i had a colleague who studiously avoided sharing contacts or introductions with me he s a vc now
502,kleiner won the battle and lost the war except the didn t because in the long run a more diverse honest investment field is better
504,ekp you are one tough cookie thank you
505,thejeffdavidson no kidding
506,rt caseymalone heathr what if we hire a woman and she sues us think of the time it ll take to crush her in court
507,suzisteffen thanks suzi you re very kind
508,thejeffdavidson morningjewshow what am i chopped liver kthalps and lenadunham is a babe
509,mt thejeffdavidson heathr morningjewshow many wmn have an intense love for their dogs comparison is not necessarily an insult kthalps
510,thejeffdavidson heathr morningjewshow dunham amp halper both talented cute funny lena is a meeskite katie is kinda hot kthalps
511,now no one will hire women whisper vcs and angels firms already not hiring women ellenpao fb
512,the thing is that any woman who s dealt with vcs knows this stuff is rampant and the water we swim in and this case has been a gauntlet
513,this wasn t the case felt pao lost the case on her cross exam and credibility mistakes were made in the response
514,my employment discrimination atty friend who was in courtroom expected a loss there s lots of discrimination out there she said
515,rt michellequinn kleiner nine that s the number we are trying to reach nine jurors have to agree on the retaliation claim
516,rt michellequinn kleiner we are in limbo here waiting in the halls but the essence is pao lost
517,rt michellequinn kleiner she loses on everything no gender discrimination and no retaliation no polling the jurors
518,rt michellequinn kleiner juror a man says yes to everything juror a man no to everything they only needed nine people to agr
519,coreyjf it s comedy
520,daphne noon twobodyproblem emilynussbaum i have no idea but she s plenty jewish for me also nobody says they re not jewish like jews
521,coreyjf maybe very literal i don t know you know yourself best
522,bethany i do a show called morningjewshow i make fun of jews every week
523,bethany ba i love you but that s not my point please re read think about the context
524,coreyjf the uproar itself is misogynistic
525,coreyjf i m saying go back to new york stories or whore of mensa coming out and tell me there was this uproar yeah right
526,fredericg did the producer of rock s show feel bullied into making a statement i dont think so plus it s funny and the bit killed
527,in other words it s not a comedy problem y all are angry about
528,if you are enraged about lenadunham s piece then you need to be enraged about chris rock s keep your daughter off the pole bit
530,emilynussbaum avidlearner just don t get to use that word very often mitzvah points nussbaum
531,coreyjf the response to dunham is arguably misogynistic unless you think people used to be this flipped out about woody allen s work
532,coreyjf it s inside corey it s a different ballgame unless you wanna call chris rocks work racist which is meshugenah
533,can t think of one rt jamescallanlast week tonight with john oliver has there ever been a show that found its voice so quickly hbo
534,cause post bibi speech election racism european events left calling jews racist a lot some n american jews frightened to say boo
535,how much of this is because people are truly scared about real anti semitism and too afraid to say that lenadunham
537,do you know how easy it is in comedy to be accused of hating men now ask yourself how often most comics are accused of hating women
539,rt michellequinn kleiner reporters wait for the court doors to open on th floor of sf superior court verdict expected at
540,and i d love to see people be willing to identify and fight anti semitism when it shows up in places where it s not a joyride to kvetch
541,emilynussbaum tcarmody i watched social network with pomeranian which was great though it signaled the end of the good ol web days
542,emilynussbaum tcarmody thanks i will that wd be a great way to watch we ll be in nyc in may hopefully do some shows too
544,i am i won t say offended but super disappointed to see so many of my people not put comedy as high as we often do oy lenadunham
545,emilynussbaum harrisj tcarmody her rape stuff is her best stuff imo i love it
546,or are you losing your mind because maybe lenadunham nailed something about some jewish men
547,emilynussbaum tcarmody dunham has gotten more grief over one shouts and murmurs piece than rock s been given over a career of gender jokes
548,walrusmaster i love that you tweeted me about this i am a proud canadian
549,how much are people going after lenadunham s piece because she s a comfortable target no bravery here edgy freedom fighters
550,you only have to see a bagel at least that s my bar but she has a jewish mum she wouldn t know some of those bits if she didn t
551,how much of the crazy resentment thrown at lenadunham is because she s jewish to be fair morningjewshow has a v low bar
552,if you are angry because you don t think lenadunham s new yorker piece is funny go read the last some of those aren t
553,you guys i ve never even seen girls but i don t care i get this piece i don t have to think it s blazing saddles to think it s humour
554,apstamm morningjewshow is ready to replace abe foxman yesterday rachelsklar
555,apstamm oh sure women are supposed to be joked about when men are it s the people oy vey iz mir rachelsklar
556,rushkoff for serious criticism than lena dunham s recent shouts and murmurs piece
557,rushkoff laws and campaigning on it it s theocratic internal israel style politics in the us that s worth way more focus for jews
558,rushkoff i don t remember the sign though i remember barney s beanery but signs about gays and aids are an old thing governors passing
559,you might be uncomfortable that doesn t make the joke anti semitic this piece is saying some uncomfortable jewish stuff out loud good
560,jews were killed in a supermarket in france recently would you even make your avatar je suis juif or are you only ballsy about dunham
561,it s offering to set a straight jewish male comic up with a jewish woman to prove miracles can happen
562,the hard stuff is facing the left when it s anti semitic it s criticizing israel without worry about being a shonda for the goyim
563,mobilize against real problems remember when you are safe find your freedom inside keep your sense of humour
564,jews freaked out by anti semitism indiana just passed a law to put up signs in stores saying no gays please take a note fr fellow queers
565,seriously i ve watched folks on the left go after their own constantly at the weirder times because it s a target you re unafraid of
567,i have never seen a piece by a jewish male comic called anti semitic not once
568,she s a jewish humorist so am i the best thing about being jewish is the jokes seriously it s our strength people don t lose it
569,it s safe to go after lenadunham because you don t like her for whatever reason so you think that makes her anti semitic
570,i co host morningjewshow and we get some anti semitic crap sent to us daily online i see it in the left plenty but
571,there s a serious rise of anti semitic public acts in europe but lenadunham s comedy is where you re brave enough to throw down
572,fellow jews and others who are freaked out by lenadunham latest piece in the newyorker we got way bigger problems
573,rachelsklar we also talk in the morningjewshow ep about why people lose their minds over lenadunham would love your take on future show
578,my cab driver via flywheel yesterday had already worked for and left lyft and uber said they didn t pay or treat drivers as well
580,rt shakestweetz one out of every six hoosiers depends on food stamps pantries to get enough to eat but by all means boycottindiana
582,pretty sure indiana s governor was hoping for backlash to outbutch walker for gop primaries til he needs help from a gay surgeon
583,i want some jewish organizations and community to watch how the lgbt ones deal with this stuff because there is another way
586,is lena dunham good for the jews tomorrow on morningjewshoww me and kthalps fb
587,rt morningjewshow there was an american nazi party rally that filled madison square garden in learning this from rememberthispod
588,gregelin been ages coffee
589,benioff many thanks for showing some leadership re indiana there may be other states that follow will you stay out of them
590,look forward to seeing prominent venture capitalists come out with commitment to diversifying their firms and the ppl they invest in
592,striving or pretending to be absolutely self sufficient is idolatry also just plain daft in passover class http t co jim oju k
593,bay area your fave community or credit union bank w best online banking patelco mechnics or other
594,simple i don t see any point in talking to bottom level customer service again no one has authority to give certain info
595,simple i ve already been through it i got conflicting advice and f u messages saying i cd have acct closed no access to exec
596,lizgannes may have to content myself with writing some for a bit already so entertained heathersomervil
597,lizgannes i d imagine they would if they re smart but this trial hasn t shown them to always be that smart heathersomervil
598,come see me and other comedians singers and vintners re imagine the passover seder this sunday citywinerynapa fb
601,lizgannes heathersomervil know if anyone got tom the nazi left are coming to get us riches perkins on record about the ellenpao trial
602,break a leg tonight in vancouver dnto sookyinlee hope to join you for a future show
603,rt teamdnto dntoinyvr is officially a sell out here s a sneak peek at the stage being set see you tonight rain city http t co lco
604,did anyone ask tom the are victims of the nazi left perkins a founding partner at kpcb for comment on the ellenpao trial fb
606,recently introduced to secure d messaging app threemaapp i really like it no user data tracking faster than apple mms messenger
607,simple no way to feel confident my account is secure
608,simple i ve already done that before i ve gotten conflicting responses phone and email
609,you need to take risks disrupt say people who scoff at ellenpao s suit which did more of both than of vc investments fb
610,if pao wins nothing gets better for women say people whose plan for things getting better is wait years for their genius daughter
611,susie c it took a lawsuit for women journalists to get on the news floor at the nytimes
612,angie seattle they look great i m in oakland
613,what vcs are gonna threaten to not hire you like evangelical christians are gonna threaten you with invisible hell you don t believe in
614,exactly what i m googling great advice rt angie seattle heathr i recommend checking out a credit union their customers are members
615,now no one will hire women whisper vcs and angels firms already not hiring women ellenpao fb
616,simple it s tough to feel secure about your bank when they start messaging you about closing your account bc you aren t w d
617,simple that is not what your customer service reps are saying to me
618,lifehacker nerdwallet love your recommend for best online banking that s not simple which tells me self employed ppl can have accts shut
619,sandyanne sure is simple
620,anyone really like their on line banking somewhere besides simple and want to recommend it self employed folks unwelcome on simple fb
621,as usual a start up acquired is no longer the same bank simple tells me if you re self employed we can close your account if we want fb
622,guy approaches my girlfriend and i kissing goodbye i get ready to cringe guy talks to me about my jack purcells guy is my new pal
625,trying to access the wordpress admin for my old site isn t show up when i input site wp admin just assurance the database is update
626,except for every maker who eats mt iammollywalsh agriculture uses of water but only generates of california s revenue gmicncc
627,i was in napa yesterday still grapes in the fields no condos yet fb
629,ginatrapani would you like a slack channel for post podcast convo
630,ablaze or xfinitywifi would love to hide that everywhere
631,rt firstpersonpbs i can count the number of out gay women who i know who have notoriety who get press on one hand nicolettemas
634,rt libroantiguo mystery writer agatha christie with her surf board fred one of the first british people to learn to surf http
636,rt sandyanne do men go to your shows thingspeoplesaytoartists
639,night good people fb
640,after working on shift magazine all those years ago a can t believe a cdn publisher couldn t keep the name now msnbc has it pomeranian
641,feliciahorowitz your piece is one of the most hopeful things i ve ever read connected to sv love to you your family
643,tedr mine too i always wanted that
644,rt weird hist the egyptian pyramids were older to the romans than the romans are to us http t co nwiu frnpp
645,night good people fb
647,caseymalone she s disrupting humiliation she s rebranded it s like arianna truthfully i m v moved by lewinsky s recent statements
648,caseymalone foreign subtitles under that white shot what is rap ha ha ha ha
650,caseymalone oh those people and their raps
652,ellenpapadakis buttery buttah rt msleamichele this tonight dgaawards barbrastreisand http t co netml jy
653,when i last played hockey there was no such thing as a stick fb
654,maegancarberry kthalps mj jew eoke tour maybe one nyc day in may
655,have an extra ticket for an awesome play in berkeley at tonight anne carson s antigonick shotgunplayers who wants it
656,bhorowitz web anildash i think leading by example and diversifying vc firms themselves will make a huge start you know leadership
657,anyone else self employed with a simple account getting any guff from the company about using their bank fb
660,rt advicetowriters write what you need to write not what is currently popular or what you think will sell p d james amwriting http
662,night good people dreaming of sleep fb
663,to recreate for themselves a childhood they never had julian fellows speaking about pl travers works for cosby too it seems
664,you often find that when people are successful in creating a childhood icon it is because not so much they love children as they want
665,ninavizz she meant in inspiring and emboldening legions of other women who have been through common experiences
666,dearsarah i followed on line myself i want to try to go to closing arguments though
667,dearsarah here s to not practicing law
668,dearsarah of course any woman who s worked in these circumstances knows the implicit sexism so well it is definitely a bit of a jolt
669,dearsarah my friend said she thought it crumbled during the cross which she didn t seem prepared for jury questions seemed a bit telling
670,dearsarah on any kind of basis but who has this has been v unusual big risk taking against those who call often themselves risk takers
671,dearsarah it s already astonishing ellen pao did i think of the number of entrepreneurs who must have wanted to sue vcs
672,dearsarah hey i am no practicing attorney but really it wouldn t surprise me to find something making cases harder to bring in ca
673,dearsarah just passing on what my practicing ca employment law pal says if plaintiff has turned down settlement offer may lead to costs
674,rt advicetowriters people who understand everything get no stories bertolt brecht fiction writing http t co yeknckpepx
675,it s twue mt grammar i am confident that heathr miswrote an update and could have posted one who s been in the instead
676,ninavizz how so the anita hill moment or re likely losing the case in this attorney s opinion pao
677,dearsarah also said it s possible if she loses she ll owe kleiner s costs too i think that may not play well for kp in media if so
678,dearsarah we are still getting a bit of an anita hill moment re the valley and vc and who knows how it ll ripple i may watch closing
679,dearsarah just talked with a friend who is an employment lawyer a v feminist one whose been in the courtroom and she says nope but pao
682,joshgondelman remaking the remake can never lead to good
684,debs kevinmarks tummelvision this is reporting and distribution it means budgets have to change as do some writing expectations imo
685,threemaapp apple app store not downloading threema right now
686,debs kevinmarks tummelvision it s hard to quantify what that does for the times as a business and still they see it s necessary good
687,mt melissafpayne breaking the body of an african american man is found hanging from a tree in claiborne county the fbi mbi on scene
691,margaretatwood brilliantly reframes is it worse diff for women than men question here putting in my pocket fb http t co j jmc cia
693,night good people fb
694,and we have a fanny pack to complete the evenings s tryptych or however you spell it fb
695,sightings tonight baby doll dress with booties cut offs with tights expecting the rubber bracelets up the arm soon fb
